{
  "name": "Message",
  "version": "1.0.0",
  "fields": {
    "id": {
      "type": "uuid",
      "required": true
    },
    "role": {
      "type": "string",
      "required": true
    },
    "content": {
      "type": "string",
      "required": true
    },
    "created_at": {
      "type": "string"
    }
  },
  "indexes": [],
  "relations": [],
  "extensions": {}
}